{
  "schemaVersion": "1.0",
  "deliveryId": "0904a074c93da29e5b7aa15991fc8663dd844cc84b3fa92a7640d8766972ccf9",
  "alertId": "b4d1c1de-5a0f-4a58-9f4c-0d0c8b6c0e11",
  "channel": "PUSH",
  "audience": "CUSTOMER",
  "severity": "HIGH",
  "customerId": "cus_8f3b1c",
  "template": {
    "id": "suspicious-transaction.v1",
    "locale": "pt-BR",
    "params": {
      "amountFormatted": "R$ 15.000,00",
      "transactionType": "PIX"
    }
  },
  "fallbackChannels": [
    "SMS"
  ],
  "attempt": 1,
  "createdAt": "2026-10-03T14:21:07.620Z",
  "expiresAt": "2026-10-03T14:31:07.620Z",
  "traceId": "4bf92f3577b34da6a3ce929d0e0e4736"
}
